input,label
冷却液温度高怎么办,车书
后备箱防夹功能咋用,车书
有什么技巧可以让续航长一点,车书
怎么打开后备箱,车书
我想唱歌，咋弄,车书
怎么开启智能驾驶功能,车书
哨兵模式如何使用,车书
我能否自行拆装动力电池,车书
大灯延时关闭在哪里打开,车书
自适应远光如何调节,车书
如何应急解锁后备箱,车书
我要怎么启动车辆,车书
我要怎么把车开走,车书
怎么更换空气滤清器滤芯,车书
尾门要怎么打开,车书
副驾车门怎么打开,车书
怎样开启车内录音,车书
后视镜怎么打开,车书
我想要打开遮阳帘怎么开,车书
我要怎么把车开走,车书
这个车可以用 iPhone 投屏吗,车书
如何让夜间驾驶更安全,车书
怎么恢复出厂设置,车书
如何打开 ADS,车书
怎么回收动力电池,车书
加油口盖板无法打开怎么办,车书
什么时候启动纯电优先模式,车书
如何修理轮胎,车书
如何开启儿童锁,车书
怎样从中控屏移屏至其他屏幕,车书
怎样调节 HUD 亮度,车书
在哪里查看 抬头显示,车书
孕妇如何佩戴安全带,车书
怎样切换到D档,车书
首次使用 ADS需要注意什么,车书
车钥匙无法打开车辆是什么原因,车书
下雨天高速公路上三角警示牌放在150m处可以吗,车书
远光灯智能调节在哪里打开,车书
我家宝宝乘坐需要注意什么,车书
怎么使用录屏功能,车书
车门锁死，怎么手动打开,车书
这台车有自动驻车功能吗,车书
副驾女王座椅是什么,车书
什么是自适应远光,车书
有哪些驾驶模式,车书
为什么小憩模式还没到时间就自动退出了？,车书
这台车油箱和电池是多少大的,车书
什么是自适应远光,车书
这台车支持车道巡航辅助吗,车书
这台车有自动驻车功能吗,车书
能量回收是什么,车书
零重力座椅是什么东西,车书
这台车的 vin 如何查看,车书
这台车的电耗是多少,车书
这台车动力电池类型是什么,车书
需要加什么汽油,车书
这台车是增程器什么型号,车书
机油压力低指示灯有什么作用,车书
瞬时功率显示红色能量条代表什么意思,车书
仪表指示灯有哪些类型,车书
抬头显示有什么作用,车书
我可以提取EDR数据吗,车书
AVH是什么功能,车书
LCC与ACC有什么区别,车书
40万买的车行程1000公里，退换车补偿多少钱,车书
增程器有哪些零部件,车书
发动机的额定功率/转速（kW/rpm）是多少,车书
用户说出“后备箱按键在哪里？。2. 系统识别并处理请求。,车书
充气泵在哪里,车书
激光雷达在哪里,车书
这车内哪里可以充电,车书
这个换挡的位置在哪里，我找不到,车书
空气悬架故障指示灯在哪,车书
后视镜是什么,车书
脚托在哪个位置,车书
HUD 投影仪在哪,车书
安全气囊警告标识在怎么查看,车书
我的车的激光雷达在哪里,车书
打开车窗的按键在哪,车书
增程器冷却液加注口在哪个位置,车书
空气悬架系统故障指示灯是什么样子,车书
下雨天驾驶车辆可以调整那些设置,车书
有什么路面辅助模式,车书
远光灯的使用技巧有哪些,车书
高压冲洗需要注意什么,车书
为什么我的车钥匙靠近车的时候会自动打开车锁呢,车书
车辆常规维护检查的规则是什么,车书
什么情况下需要换轮胎,车书
雨刮器可以多久更换一次？,车书
儿童坐在副驾可以吗,车书
车内能否带宠物,车书
涉水驾驶车速能不能开快点,车书
驾驶车辆时候打电话违规吗,车书
车辆行驶过程中能调整座椅吗,车书
什么情况下360° 全景环视功能无法正常工作,车书
汽车保养有哪些作用,车书
车辆行程11万公里在不在保修范围内,车书
车辆使用3年，核心零部件能保修吗,车书
SOS救援电话中断是什么原因,车书
